{
  "$schema": "https://json-schema.org/draft/2020-12/schema",
  "$id": "odd_world_model.covariance_edge.schema.json",
  "title": "CovarianceEdge",
  "type": "object",
  "additionalProperties": false,
  "required": [
    "schema_kind",
    "schema_version",
    "edge_id",
    "source_object_ref",
    "target_object_ref",
    "relationship_kind"
  ],
  "properties": {
    "schema_kind": {
      "const": "odd_world_model.covariance_edge"
    },
    "schema_version": {
      "const": "v1"
    },
    "edge_id": {
      "type": "string",
      "minLength": 1
    },
    "source_object_ref": {
      "type": "string",
      "minLength": 1
    },
    "target_object_ref": {
      "type": "string",
      "minLength": 1
    },
    "relationship_kind": {
      "type": "string",
      "enum": [
        "equivalent",
        "corresponding",
        "partial_correspondence",
        "treatment_effect",
        "aggregation",
        "decomposition"
      ]
    },
    "ambiguity_notes": {
      "$ref": "world_model_object.schema.json#/$defs/string_array"
    }
  }
}
